59,532,J,"Hai Huang; Roland-Holst, D.; Springer, C.H.; Can Wang",,,,,,,,How Will an Emissions Trading System Affect Household Income and Social Equity? A CGE-Based Case Study of China,,,,,,,,Energy Procedia,,,,158.0,,,,4017,22,,10.1016/j.egypro.2019.01.838,,,,Feb. 2019,2019,"Recently, China's National Development and Reform Commission (NDRC) announced the establishment of a nationwide carbon emissions trading system (ETS), which will be the largest ETS in the world. The national ETS directly encourages enterprises to make a low-carbon transition through market mechanisms. In addition, the ETS is a potential source of significant government revenue through the auction of emissions permits. The allocation of this revenue is an important consideration for the NDRC. Some ETS areas already have experience with revenue recycling. For example, the California government directly returns ETS revenue to residents through electricity bill credits, as well as dedicated some of the revenue to the Greenhouse Gas Reduction Fund (GGRF). This study uses a computable general equilibrium (CGE) model to explore the economic impact of directly returning the revenue from the ETS to residents in China. At the same time, taking into account the significant differences between different income groups in urban and rural areas in China, the research explores the difference between different distribution policies. The results show that the coal industry will suffer the greatest negative impact from the ETS. By 2050, the number of people employed in the coal industry will fall by 63.8% compared to 2012, and under the ETS scenario, coal employment will decrease by 75.3%. However, these employment effects can be mitigated by targeted transfers to the displaced coal workers using ETS revenue. At the national level, ETS policies have a positive effect on GDP due to the income effect of revenue recycling. From the perspective of household income, the ETS policies will have differing impacts on different income groups. In addition, different income distribution methods will also change the impact on the income of different groups. Among these revenue distribution options, the distribution by population be most conducive to the promotion of social equity. [All rights reserved Elsevier].",,,,,,,,,2,0,0,0.0,0,0,2,,,1876-6102,,,INSPEC:18996731,,"How Will an Emissions Trading System Affect Household Income and Social Equity? A CGE-Based Case Study of ChinaRecently, China's National Development and Reform Commission (NDRC) announced the establishment of a nationwide carbon emissions trading system (ETS), which will be the largest ETS in the world. The national ETS directly encourages enterprises to make a low-carbon transition through market mechanisms. In addition, the ETS is a potential source of significant government revenue through the auction of emissions permits. The allocation of this revenue is an important consideration for the NDRC. Some ETS areas already have experience with revenue recycling. For example, the California government directly returns ETS revenue to residents through electricity bill credits, as well as dedicated some of the revenue to the Greenhouse Gas Reduction Fund (GGRF). This study uses a computable general equilibrium (CGE) model to explore the economic impact of directly returning the revenue from the ETS to residents in China. At the same time, taking into account the significant differences between different income groups in urban and rural areas in China, the research explores the difference between different distribution policies. The results show that the coal industry will suffer the greatest negative impact from the ETS. By 2050, the number of people employed in the coal industry will fall by 63.8% compared to 2012, and under the ETS scenario, coal employment will decrease by 75.3%. However, these employment effects can be mitigated by targeted transfers to the displaced coal workers using ETS revenue. At the national level, ETS policies have a positive effect on GDP due to the income effect of revenue recycling. From the perspective of household income, the ETS policies will have differing impacts on different income groups. In addition, different income distribution methods will also change the impact on the income of different groups. Among these revenue distribution options, the distribution by population be most conducive to the promotion of social equity. [All rights reserved Elsevier].",0.0,1.0,0.0,0.0,2.0,0.0,0.0,0.0,1.0,0.0,0.0,0.0,0.0,3.0,0.0,1.0,0.0,0.0,0.0,0.0,0.0,1.0,0.0,1.0,0.0,1.0,1.0,0.0,1.0,0.0,0.0,1.0,0.0,14.0,14.0,0,323,0.0433436532507739,True,True,True,True,True,True,False,False,False,False,True,2.0,2.0,2.0,1.0,6.0,5.0,False,False,False,2.0,2.0,2.0,1.0,6.0,5.0,False,False,False,4.0,4.0,4.0,12.0,False,0
61,534,J,"Caron, Justin; Cohen, Stuart M.; Brown, Maxwell; Reilly, John M.",,,,,,,,EXPLORING THE IMPACTS OF A NATIONAL U.S. CO2 TAX AND REVENUE RECYCLING OPTIONS WITH A COUPLED ELECTRICITY-ECONOMY MODEL,,,,,,,,CLIMATE CHANGE ECONOMICS,,,,9.0,1,,,,,1840015,10.1142/S2010007818400158,,,,FEB 2018,2018,"This paper provides a comprehensive exploration of the impacts of economy-wide CO2 taxes in the U.S. simulated using a detailed electric sector model [the National Renewable Energy Laboratory's Regional Energy Deployment System (ReEDS)] linked with a computable general equilibrium model of the U.S. economy [the Massachusetts Institute of Technology's U.S. Regional Energy Policy (USREP) model]. We implement various tax trajectories and options for using the revenue collected by the tax and describe their impact on household welfare and its distribution across income levels. Overall, we find that our top-down/bottom-up models affects estimates of the distribution and cost of emission reductions as well as the amount of revenue collected, but that these are mostly insensitive to the way the revenue is recycled. We find that substantial abatement opportunities through fuel switching and renewable penetration in the electricity sector allow the economy to accommodate extensive emissions reductions at relatively low cost. While welfare impacts are largely determined by the choice of revenue recycling scheme, all tax levels and schemes provide net benefits when accounting for the avoided global climate change benefits of emission reductions. Recycling revenue through capital income tax rebates is more efficient than labor income tax rebates or uniform transfers to households. While capital tax rebates substantially reduce the overall costs of emission abatement, they profit high income households the most and are regressive. We more generally identify a clear trade-off between equity and efficiency across the various recycling options. However, we show through a set of hybrid recycling schemes that it is possible to limit inequalities in impacts, particularly those on the lowest income households, at relatively little incremental cost.",,,,,,,,,12,0,0,0.0,1,0,12,,,2010-0078,2010-0086,,WOS:000428286000015,,"EXPLORING THE IMPACTS OF A NATIONAL U.S. CO2 TAX AND REVENUE RECYCLING OPTIONS WITH A COUPLED ELECTRICITY-ECONOMY MODELThis paper provides a comprehensive exploration of the impacts of economy-wide CO2 taxes in the U.S. simulated using a detailed electric sector model [the National Renewable Energy Laboratory's Regional Energy Deployment System (ReEDS)] linked with a computable general equilibrium model of the U.S. economy [the Massachusetts Institute of Technology's U.S. Regional Energy Policy (USREP) model]. We implement various tax trajectories and options for using the revenue collected by the tax and describe their impact on household welfare and its distribution across income levels. Overall, we find that our top-down/bottom-up models affects estimates of the distribution and cost of emission reductions as well as the amount of revenue collected, but that these are mostly insensitive to the way the revenue is recycled. We find that substantial abatement opportunities through fuel switching and renewable penetration in the electricity sector allow the economy to accommodate extensive emissions reductions at relatively low cost. While welfare impacts are largely determined by the choice of revenue recycling scheme, all tax levels and schemes provide net benefits when accounting for the avoided global climate change benefits of emission reductions. Recycling revenue through capital income tax rebates is more efficient than labor income tax rebates or uniform transfers to households. While capital tax rebates substantially reduce the overall costs of emission abatement, they profit high income households the most and are regressive. We more generally identify a clear trade-off between equity and efficiency across the various recycling options. However, we show through a set of hybrid recycling schemes that it is possible to limit inequalities in impacts, particularly those on the lowest income households, at relatively little incremental cost.",0.0,1.0,0.0,1.0,0.0,0.0,1.0,0.0,0.0,0.0,0.0,0.0,0.0,0.0,0.0,4.0,0.0,0.0,0.0,0.0,0.0,0.0,0.0,4.0,0.0,0.0,0.0,0.0,0.0,0.0,0.0,1.0,0.0,12.0,12.0,0,288,0.0416666666666666,True,True,True,True,True,True,False,False,False,False,True,2.0,2.0,2.0,1.0,2.0,5.0,False,False,False,2.0,2.0,2.0,1.0,2.0,5.0,False,False,False,4.0,4.0,4.0,12.0,False,0
62,535,J,"Martenies, Sheena E.; Akherati, Ali; Jathar, Shantanu; Magzamen, Sheryl",,,,"Akherati, Ali/AAH-4607-2020","Akherati, Ali/0000-0002-2919-2179; Martenies, Sheena/0000-0001-9206-5132; Magzamen, Sheryl/0000-0002-2874-3530",,,Health and Environmental Justice Implications of Retiring Two Coal-Fired Power Plants in the Southern Front Range Region of Colorado,,,,,,,,GEOHEALTH,,,,3.0,9,,,266,283,,10.1029/2019GH000206,,SEP 2019,,SEP 2019,2019,"Despite improvements in air quality over the past 50 years, ambient air pollution remains an important public health issue in the United States. In particular, emissions from coal-fired power plants still have a substantial impact on both nearby and regional populations. Of particular concern is the potential for this impact to fall disproportionately on low-income communities and communities of color. We conducted a quantitative health impact assessment to estimate the health benefits of the proposed decommissioning of two coal-fired electricity generating stations in the Southern Front Range region of Colorado. We estimated changes in exposures to fine particulate matter and ozone using the Community Multiscale Air Quality model and predicted avoided health impacts and related economic values. We also quantitatively assessed the distribution of these benefits by population-level socioeconomic status. Across the study area, decommissioning the power plants would result in 2 (95% CI: 1-3) avoided premature deaths each year due to reduced PM2.5 exposures and greater reductions in hospitalizations and other morbidities. Health benefits resulting from the modeled shutdowns were greatest in areas with lower educational attainment and other economic indicators. Our results suggest that decommissioning these power plants and replacing them with zero-emissions sources could have broad public health benefits for residents of Colorado, with larger benefits for those that are socially disadvantaged. Our results also suggested that researchers and decision makers need to consider the unique demographics of their study areas to ensure that important opportunities to reduce health disparities associated with point-source pollution.",,,,,,,,,6,0,0,0.0,2,0,6,,,2471-1403,,,WOS:000490767600001,32159046.0,"Health and Environmental Justice Implications of Retiring Two Coal-Fired Power Plants in the Southern Front Range Region of ColoradoDespite improvements in air quality over the past 50 years, ambient air pollution remains an important public health issue in the United States. In particular, emissions from coal-fired power plants still have a substantial impact on both nearby and regional populations. Of particular concern is the potential for this impact to fall disproportionately on low-income communities and communities of color. We conducted a quantitative health impact assessment to estimate the health benefits of the proposed decommissioning of two coal-fired electricity generating stations in the Southern Front Range region of Colorado. We estimated changes in exposures to fine particulate matter and ozone using the Community Multiscale Air Quality model and predicted avoided health impacts and related economic values. We also quantitatively assessed the distribution of these benefits by population-level socioeconomic status. Across the study area, decommissioning the power plants would result in 2 (95% CI: 1-3) avoided premature deaths each year due to reduced PM2.5 exposures and greater reductions in hospitalizations and other morbidities. Health benefits resulting from the modeled shutdowns were greatest in areas with lower educational attainment and other economic indicators. Our results suggest that decommissioning these power plants and replacing them with zero-emissions sources could have broad public health benefits for residents of Colorado, with larger benefits for those that are socially disadvantaged. Our results also suggested that researchers and decision makers need to consider the unique demographics of their study areas to ensure that important opportunities to reduce health disparities associated with point-source pollution.",0.0,1.0,0.0,0.0,0.0,0.0,0.0,0.0,0.0,0.0,0.0,0.0,0.0,0.0,0.0,2.0,1.0,0.0,0.0,0.0,0.0,0.0,0.0,0.0,0.0,3.0,2.0,2.0,0.0,0.0,0.0,0.0,0.0,11.0,11.0,0,265,0.0415094339622641,True,True,True,True,True,True,False,False,True,True,True,2.0,2.0,2.0,1.0,6.0,5.0,False,False,False,2.0,3.0,2.0,1.0,6.0,5.0,False,False,False,4.0,5.0,4.0,13.0,False,0
63,536,J,"Jorgenson, Dale W.; Goettle, Richard J.; Ho, Mun S.; Wilcoxen, Peter J.",,,,"Ho, Mun/ABI-4730-2020",,,,THE WELFARE CONSEQUENCES OF TAXING CARBON,,,,,,,,CLIMATE CHANGE ECONOMICS,,,,9.0,1,,,,,1840013,10.1142/S2010007818400134,,,,FEB 2018,2018,"For EMF 32, we applied a new version of our Intertemporal General Equilibrium Model (IGEM) based on the North American Industry Classification System (NAICS). We simulated the impacts arising from the Energy Modeling Forum's broad range of carbon taxes under three revenue recycling options - lump sum redistributions, capital tax reductions, and labor tax cuts. We examined their consequences for industry prices and quantities, for the overall economy, and for the welfare of households, individuals, and society, the latter in terms of efficiency and equity. We rank recycling mechanisms from most to least favorable in terms of the magnitudes of their impacts on net social welfare - efficiency net of equity - recognizing that other objectives may be more important to policy makers and the public. Finally, we and the EMF 32 effort focus only on the economic effects of carbon taxation and revenue recycling; the environmental benefits arising from emissions reductions are not within our scope of study.We find CO2 emissions abatement to be invariant to the chosen recycling scheme. This means that policy makers need not compromise their environmental objectives when designing carbon tax swap options. We also find additional emissions reductions beyond the scope of coverage and points of taxation.Reducing capital taxes promotes new saving, investment and capital formation and is the most favorable recycling mechanism. In 2010 dollars, the welfare loss per ton abated ranges from $0.19 to $3.90 depending on the path of carbon prices. Reducing labor taxes promotes consumption and work through real-wage incentives and is the next most favorable recycling scheme. Here, the welfare loss per ton abated ranges from $11.09 to $16.49 depending on the carbon tax trajectory. Lump sum redistribution of carbon tax revenues is the least favorable recycling option. It incentivizes neither capital nor labor. Consequently, the damages to the economy and welfare are the greatest among the three schemes. With lump sum recycling, the welfare loss per ton abated ranges from $37.15 to $43.61 as carbon taxation becomes more aggressive. While this ranking is common among the participating EMF 32 models, the spread in our results is the greatest in comparison which we attribute to the substitution possibilities inherent in IGEM's econometrics, the absence of barriers to factor mobility, and likely differences in the manner in which tax incentives are structured.We find welfare gains are possible under capital and labor tax recycling when emissions accounting is viewed from a top-down rather than a bottom-up perspective and carbon pricing is at an economy-wide average. However, these gains occur at the expense of abatement.We find capital tax recycling to be regressive while labor tax recycling is progressive as is redistribution through lump sums. Moreover, we find that the lump sum mechanism provides the best means for sheltering the poorest from the welfare consequences of carbon taxation. Thus, promoting capital formation is the best use of carbon tax revenues in terms of reducing the magnitudes of welfare losses while the lump sum and labor tax options are the best uses for reducing inequality.",,,,,,,,,9,0,0,0.0,0,0,9,,,2010-0078,2010-0086,,WOS:000428286000013,,"THE WELFARE CONSEQUENCES OF TAXING CARBONFor EMF 32, we applied a new version of our Intertemporal General Equilibrium Model (IGEM) based on the North American Industry Classification System (NAICS). We simulated the impacts arising from the Energy Modeling Forum's broad range of carbon taxes under three revenue recycling options - lump sum redistributions, capital tax reductions, and labor tax cuts. We examined their consequences for industry prices and quantities, for the overall economy, and for the welfare of households, individuals, and society, the latter in terms of efficiency and equity. We rank recycling mechanisms from most to least favorable in terms of the magnitudes of their impacts on net social welfare - efficiency net of equity - recognizing that other objectives may be more important to policy makers and the public. Finally, we and the EMF 32 effort focus only on the economic effects of carbon taxation and revenue recycling; the environmental benefits arising from emissions reductions are not within our scope of study.We find CO2 emissions abatement to be invariant to the chosen recycling scheme. This means that policy makers need not compromise their environmental objectives when designing carbon tax swap options. We also find additional emissions reductions beyond the scope of coverage and points of taxation.Reducing capital taxes promotes new saving, investment and capital formation and is the most favorable recycling mechanism. In 2010 dollars, the welfare loss per ton abated ranges from $0.19 to $3.90 depending on the path of carbon prices. Reducing labor taxes promotes consumption and work through real-wage incentives and is the next most favorable recycling scheme. Here, the welfare loss per ton abated ranges from $11.09 to $16.49 depending on the carbon tax trajectory. Lump sum redistribution of carbon tax revenues is the least favorable recycling option. It incentivizes neither capital nor labor. Consequently, the damages to the economy and welfare are the greatest among the three schemes. With lump sum recycling, the welfare loss per ton abated ranges from $37.15 to $43.61 as carbon taxation becomes more aggressive. While this ranking is common among the participating EMF 32 models, the spread in our results is the greatest in comparison which we attribute to the substitution possibilities inherent in IGEM's econometrics, the absence of barriers to factor mobility, and likely differences in the manner in which tax incentives are structured.We find welfare gains are possible under capital and labor tax recycling when emissions accounting is viewed from a top-down rather than a bottom-up perspective and carbon pricing is at an economy-wide average. However, these gains occur at the expense of abatement.We find capital tax recycling to be regressive while labor tax recycling is progressive as is redistribution through lump sums. Moreover, we find that the lump sum mechanism provides the best means for sheltering the poorest from the welfare consequences of carbon taxation. Thus, promoting capital formation is the best use of carbon tax revenues in terms of reducing the magnitudes of welfare losses while the lump sum and labor tax options are the best uses for reducing inequality.",0.0,0.0,0.0,0.0,10.0,0.0,0.0,2.0,0.0,0.0,0.0,0.0,0.0,2.0,0.0,1.0,0.0,0.0,0.0,0.0,0.0,0.0,0.0,1.0,0.0,2.0,0.0,0.0,0.0,0.0,0.0,2.0,1.0,21.0,21.0,0,506,0.0415019762845849,True,True,True,True,True,True,False,False,True,False,True,2.0,2.0,2.0,1.0,2.0,5.0,False,False,False,2.0,3.0,2.0,1.0,2.0,5.0,False,False,False,4.0,5.0,4.0,13.0,False,0
64,537,J,"Recalde, Martina; Peralta, Andres; Oliveras, Laura; Tirado-Herrero, Sergio; Borrell, Carme; Palencia, Laia; Gotsens, Merce; Artazcoz, Lucia; Mari-Dell'Olmo, Marc",,,,"Chiriboga, Alejandro Andrs Peralta/K-3517-2017; Herrero, Sergio Tirado/AAA-6465-2020; ARTAZCOZ, LUCIA/G-9538-2017","Chiriboga, Alejandro Andrs Peralta/0000-0002-7617-108X; Herrero, Sergio Tirado/0000-0003-3187-1039; ARTAZCOZ, LUCIA/0000-0002-6300-5111; Oliveras, Laura/0000-0003-0033-7829",,,Structural energy poverty vulnerability and excess winter mortality in the European Union: Exploring the association between structural determinants and health,,,,,,,,ENERGY POLICY,,,,133.0,,,,,,110869,10.1016/j.enpol.2019.07.005,,,,OCT 2019,2019,"Energy poverty (EP) is a growing problem in the European Union (EU) that affects the population's health. EP is structurally determined by broader political and socio-economic conditions. Our aims were to analyze the configuration of these determinants in each EU-27 country through the creation of a structural energy poverty vulnerability (SEPV) index, to group countries according to their SEPV index scores, and to explore the association between SEPV and EP prevalence, and also with excess winter mortality (EWM). We created a SEPV index through satiated principal component analyses and then validated the index. We performed a hierarchical cluster analysis (HCA) to group countries according to their SEPV. A Poisson regression model was fitted to analyze the association between SEPV and EWM. The final index comprised 13 indicators and showed an unequal distribution of SEPV across the EU. The HCA identified countries with high structural vulnerability (southeastern Europe) and countries with low structural vulnerability (northwestern Europe). The most vulnerable countries showed a statistically significant higher EP prevalence and risk of EWM. The SEPV index summarizes the structural determinants of EP across the EU, allows to identify geographical patterns and to study how the structural determinants of EP affect health.",,,,,,,,,49,0,0,0.0,0,1,49,,,0301-4215,1873-6777,,WOS:000496896800021,,"Structural energy poverty vulnerability and excess winter mortality in the European Union: Exploring the association between structural determinants and healthEnergy poverty (EP) is a growing problem in the European Union (EU) that affects the population's health. EP is structurally determined by broader political and socio-economic conditions. Our aims were to analyze the configuration of these determinants in each EU-27 country through the creation of a structural energy poverty vulnerability (SEPV) index, to group countries according to their SEPV index scores, and to explore the association between SEPV and EP prevalence, and also with excess winter mortality (EWM). We created a SEPV index through satiated principal component analyses and then validated the index. We performed a hierarchical cluster analysis (HCA) to group countries according to their SEPV. A Poisson regression model was fitted to analyze the association between SEPV and EWM. The final index comprised 13 indicators and showed an unequal distribution of SEPV across the EU. The HCA identified countries with high structural vulnerability (southeastern Europe) and countries with low structural vulnerability (northwestern Europe). The most vulnerable countries showed a statistically significant higher EP prevalence and risk of EWM. The SEPV index summarizes the structural determinants of EP across the EU, allows to identify geographical patterns and to study how the structural determinants of EP affect health.",2.0,0.0,0.0,0.0,0.0,0.0,0.0,0.0,0.0,0.0,0.0,0.0,0.0,0.0,0.0,1.0,1.0,0.0,0.0,0.0,0.0,0.0,0.0,0.0,0.0,4.0,1.0,0.0,0.0,0.0,0.0,0.0,0.0,9.0,9.0,0,217,0.0414746543778801,True,True,True,True,True,True,False,False,True,False,True,3.0,2.0,2.0,1.0,8.0,5.0,False,False,False,3.0,2.0,2.0,1.0,6.0,5.0,False,False,False,6.0,4.0,4.0,14.0,False,0
