5,5,J,"Streimikiene, Dalia; Kyriakopoulos, Grigorios L.; Lekavicius, Vidas; Siksnelyte-Butkiene, Indre",,,,"Lekavicius, Vidas/X-1913-2019; Kyriakopoulos, Grigorios L./A-5933-2008","Kyriakopoulos, Grigorios L./0000-0003-4875-8534; Siksnelyte-Butkiene, Indre/0000-0002-0927-4847",,,Energy Poverty and Low Carbon Just Energy Transition: Comparative Study in Lithuania and Greece,,,,,,,,SOCIAL INDICATORS RESEARCH,,,,158.0,1,,,319,371,,10.1007/s11205-021-02685-9,,APR 2021,,NOV 2021,2021,"EU has set ambitious commitment to achieve low carbon energy and economy transition up to 2050. This low carbon transition means sustainable energy development path based on renewable energy sources and first of all should address the energy poverty vulnerability and justice issues. The main goal of the paper is to develop indicators framework for assessing low carbon just energy transition and to apply this framework for analysis how climate change mitigation policies in households targeting enhancement of energy renovation of residential buildings and promotion of the use of micro-generation technologies and other policies are affecting household's energy poverty and vulnerability in selected countries: Lithuania and Greece. This framework allows to assess three main dimensions of sustainable energy development: environmental, social and economic. The paper provides policy recommendations how to deal with just low carbon energy transition which means addressing energy poverty issues during moving to 100% renewables in power generation based on performed case studies.",,,,,,,,,12,0,0,0.0,0,0,12,,,0303-8300,1573-0921,,WOS:000645490900001,33941997.0,"Energy Poverty and Low Carbon Just Energy Transition: Comparative Study in Lithuania and GreeceEU has set ambitious commitment to achieve low carbon energy and economy transition up to 2050. This low carbon transition means sustainable energy development path based on renewable energy sources and first of all should address the energy poverty vulnerability and justice issues. The main goal of the paper is to develop indicators framework for assessing low carbon just energy transition and to apply this framework for analysis how climate change mitigation policies in households targeting enhancement of energy renovation of residential buildings and promotion of the use of micro-generation technologies and other policies are affecting household's energy poverty and vulnerability in selected countries: Lithuania and Greece. This framework allows to assess three main dimensions of sustainable energy development: environmental, social and economic. The paper provides policy recommendations how to deal with just low carbon energy transition which means addressing energy poverty issues during moving to 100% renewables in power generation based on performed case studies.",10.0,0.0,0.0,1.0,4.0,2.0,2.0,1.0,4.0,0.0,2.0,0.0,0.0,3.0,0.0,0.0,1.0,0.0,0.0,0.0,3.0,0.0,0.0,2.0,0.0,1.0,0.0,0.0,0.0,0.0,1.0,0.0,0.0,37.0,37.0,0,169,0.2189349112426035,True,True,True,True,True,True,False,False,True,False,True,3.0,3.0,1.0,1.0,7.0,5.0,False,False,False,3.0,2.0,1.0,1.0,6.0,5.0,False,False,False,6.0,5.0,2.0,13.0,False,0
6,6,J,"Wang, Jiayu; Wang, Ke; Wei, Yi-Ming",,,,"Wang, Ke/T-3646-2018","Wang, Ke/0000-0002-4808-2637; Wang, Jiayu/0000-0002-1479-3748",,,How to balance China's sustainable development goals through industrial restructuring: a multi-regional input-output optimization of the employment-energy-water-emissions nexus,,,,,,,,ENVIRONMENTAL RESEARCH LETTERS,,,,15.0,3,,,,,34018,10.1088/1748-9326/ab666a,,,,MAR 2020,2020,"To effectively manage economic transition and pursue sustainable development, the Chinese government has promulgated a series of policies in the 13th Five Year (2016-2020) Plan (FYP), covering social security, economic growth, energy transition, resource conservation, and environmental protection. To balance the various 13th FYP policy targets, we propose a multi-objective optimization model based on multi-regional input-output analysis. The model integrates the management of employment, energy consumption, water use, carbon emissions, and pollutant emissions by determining a policy-dominated industrial restructuring pathway that would best achieve consistency in sustainable development policies, adaptation to the national industrial development trend, and regional equity among China's provinces. Synergies and trade-offs among various policies are also discussed. Our optimization results show that an energy-consumption dominated industrial restructuring pathway is the best solution, as it would satisfy various sustainable targets, facilitate (restrain) development of high-value-added (high-energy-consumption and high-emissions) sectors, as well as improve regional equity. Therefore, to realize sustainability, the energy policy should be prioritized when formulating an industrial restructuring pathway. Applying such a multi-objective optimization model provides policymakers with a comprehensive approach to support sustainable development policies.",,,,,,,,,11,1,0,0.0,4,0,12,,,1748-9326,,,WOS:000537406900007,,"How to balance China's sustainable development goals through industrial restructuring: a multi-regional input-output optimization of the employment-energy-water-emissions nexusTo effectively manage economic transition and pursue sustainable development, the Chinese government has promulgated a series of policies in the 13th Five Year (2016-2020) Plan (FYP), covering social security, economic growth, energy transition, resource conservation, and environmental protection. To balance the various 13th FYP policy targets, we propose a multi-objective optimization model based on multi-regional input-output analysis. The model integrates the management of employment, energy consumption, water use, carbon emissions, and pollutant emissions by determining a policy-dominated industrial restructuring pathway that would best achieve consistency in sustainable development policies, adaptation to the national industrial development trend, and regional equity among China's provinces. Synergies and trade-offs among various policies are also discussed. Our optimization results show that an energy-consumption dominated industrial restructuring pathway is the best solution, as it would satisfy various sustainable targets, facilitate (restrain) development of high-value-added (high-energy-consumption and high-emissions) sectors, as well as improve regional equity. Therefore, to realize sustainability, the energy policy should be prioritized when formulating an industrial restructuring pathway. Applying such a multi-objective optimization model provides policymakers with a comprehensive approach to support sustainable development policies.",6.0,0.0,0.0,0.0,1.0,6.0,0.0,1.0,2.0,0.0,6.0,3.0,0.0,8.0,0.0,3.0,0.0,0.0,4.0,0.0,0.0,0.0,0.0,0.0,0.0,1.0,0.0,0.0,0.0,0.0,0.0,2.0,0.0,43.0,43.0,0,198,0.2171717171717171,True,True,True,True,True,True,False,False,True,True,True,2.0,2.0,2.0,1.0,1.0,5.0,False,False,False,2.0,2.0,2.0,1.0,3.0,5.0,False,False,False,4.0,4.0,4.0,12.0,False,0
7,7,J,"Andreas, Jan-Justus; Burns, Charlotte; Touza, Julia",,,,,"Touza Montero, Julia/0000-0001-8170-1789",,,Overcoming energy injustice? Bulgaria's renewable energy transition in times of crisis,,,,,,,,ENERGY RESEARCH & SOCIAL SCIENCE,,,,42.0,,,,44,52,,10.1016/j.erss.2018.02.020,,,,AUG 2018,2018,"The effects of renewable energy transitions on energy costs and economic growth have led to cost concerns and a prioritisation of economic issues during the economic crisis. Bulgaria, the EU's poorest state has nevertheless already achieved its 2020 renewable energy targets. This achievement seems to challenge the widely held assumption that poorer countries struggle to meet environmental objectives. This paper analyses the drivers and implications of Bulgaria's renewables expansion in order to test general expectations on influential factors shaping renewable energy transitions in the context of poor states. The analysis employs the energy justice framework to identify the justice, equity and fairness implications of Bulgaria's renewable energy for its energy system. Despite the clear justice implications raised by changing energy systems, there are limited pieces analysing the relationship between renewable energy transitions and energy justice. The analysis shows that whilst Bulgaria was able to reach its renewables targets, the mismanaged, opaque and corrupted policy framework undermines the longterm viability of its energy transition. The analysis confirms the importance of long term strategies, effective policies and a supportive macroeconomic context for renewable energy transitions, and highlights the negative implications of renewables to achieve greater energy justice if these factors are omitted.",,,,,,,,,17,0,0,0.0,1,0,17,,,2214-6296,2214-6326,,WOS:000439444400006,,"Overcoming energy injustice? Bulgaria's renewable energy transition in times of crisisThe effects of renewable energy transitions on energy costs and economic growth have led to cost concerns and a prioritisation of economic issues during the economic crisis. Bulgaria, the EU's poorest state has nevertheless already achieved its 2020 renewable energy targets. This achievement seems to challenge the widely held assumption that poorer countries struggle to meet environmental objectives. This paper analyses the drivers and implications of Bulgaria's renewables expansion in order to test general expectations on influential factors shaping renewable energy transitions in the context of poor states. The analysis employs the energy justice framework to identify the justice, equity and fairness implications of Bulgaria's renewable energy for its energy system. Despite the clear justice implications raised by changing energy systems, there are limited pieces analysing the relationship between renewable energy transitions and energy justice. The analysis shows that whilst Bulgaria was able to reach its renewables targets, the mismanaged, opaque and corrupted policy framework undermines the longterm viability of its energy transition. The analysis confirms the importance of long term strategies, effective policies and a supportive macroeconomic context for renewable energy transitions, and highlights the negative implications of renewables to achieve greater energy justice if these factors are omitted.",15.0,0.0,0.0,0.0,0.0,0.0,10.0,1.0,6.0,0.0,0.0,0.0,1.0,2.0,0.0,0.0,0.0,0.0,0.0,0.0,2.0,0.0,0.0,0.0,0.0,0.0,0.0,0.0,0.0,0.0,6.0,1.0,0.0,44.0,44.0,0,210,0.2095238095238095,True,True,True,True,True,True,False,False,True,True,True,2.0,2.0,2.0,2.0,6.0,5.0,True,False,False,2.0,2.0,2.0,2.0,6.0,5.0,False,False,True,4.0,4.0,4.0,12.0,False,1
8,8,J,"Hanke, Florian; Guyet, Rachel; Feenstra, Marielle",,,,,,,,Do renewable energy communities deliver energy justice? Exploring insights from 71 European cases,,,,,,,,ENERGY RESEARCH & SOCIAL SCIENCE,,,,80.0,,,,,,102244,10.1016/j.erss.2021.102244,,AUG 2021,,OCT 2021,2021,"A growing energy justice literature underlines that complex energy injustices in energy transition disproportionally affect vulnerable and energy-poor households. Literature and policies discuss renewable energy communities' (RECs) potential to enable citizen participation in energy transition and shape a just transition. Low-income and energy-poor households could benefit from granting access to affordable energy tariffs and energy efficiency measures when participating in RECs. Recent EU legislation highlights RECs' social role in energy poverty alleviation and stipulates the participation of all social groups in RECs, especially those groups that are underrepresented under RECs' members. In this light, the energy justice framework is increasingly applied to analyse RECs' social contributions in different countries. Still, empirical evidence of RECs' capacity to include underrepresented and vulnerable groups and mitigate energy poverty as a particular form of energy justice remains scarce. Drawing on data collected among 71 European RECs, our exploratory research investigates how RECs engage in this social role by improving participatory procedures to enable vulnerable groups' participation and by distributing affordable energy and energy efficiency to vulnerable households. Using the energy justice framework, we explore how RECs resonate with the three energy justice tenets (distributive, recognitional and procedural) by addressing underrepresented groups and energy poverty.",,,,,,,,,10,0,0,0.0,0,0,10,,,2214-6296,2214-6326,,WOS:000722568500013,,"Do renewable energy communities deliver energy justice? Exploring insights from 71 European casesA growing energy justice literature underlines that complex energy injustices in energy transition disproportionally affect vulnerable and energy-poor households. Literature and policies discuss renewable energy communities' (RECs) potential to enable citizen participation in energy transition and shape a just transition. Low-income and energy-poor households could benefit from granting access to affordable energy tariffs and energy efficiency measures when participating in RECs. Recent EU legislation highlights RECs' social role in energy poverty alleviation and stipulates the participation of all social groups in RECs, especially those groups that are underrepresented under RECs' members. In this light, the energy justice framework is increasingly applied to analyse RECs' social contributions in different countries. Still, empirical evidence of RECs' capacity to include underrepresented and vulnerable groups and mitigate energy poverty as a particular form of energy justice remains scarce. Drawing on data collected among 71 European RECs, our exploratory research investigates how RECs engage in this social role by improving participatory procedures to enable vulnerable groups' participation and by distributing affordable energy and energy efficiency to vulnerable households. Using the energy justice framework, we explore how RECs resonate with the three energy justice tenets (distributive, recognitional and procedural) by addressing underrepresented groups and energy poverty.",20.0,0.0,0.0,0.0,0.0,0.0,2.0,0.0,3.0,0.0,0.0,0.0,0.0,1.0,0.0,0.0,0.0,0.0,0.0,0.0,2.0,0.0,0.0,3.0,0.0,4.0,0.0,2.0,0.0,0.0,7.0,0.0,0.0,44.0,44.0,0,212,0.2075471698113207,True,True,True,True,True,True,False,False,True,False,True,3.0,2.0,2.0,1.0,6.0,5.0,False,False,False,2.0,2.0,2.0,1.0,6.0,5.0,False,False,False,5.0,4.0,4.0,13.0,False,0
9,9,J,"Musango, Josephine Kaviti; Bassi, Andrea M.",,,,,"Bassi, Andrea Marcello/0000-0001-8170-8024",,,Towards a Systemic Assessment of Gendered Energy Transition in Urban Households,,,,,,,,ENERGIES,,,,14.0,21,,,,,7251,10.3390/en14217251,,,,NOV 2021,2021,"Assessment of gendered energy transition at an urban scale has emerged as a challenging issue for researchers, policy makers and practitioners. With municipalities becoming players in the energy markets, their involvement raises policy issues that need to be better assessed in supporting gendered energy transition. This paper, therefore, contributes to gendered energy transition assessments at urban household level from a policy maker perspective. We developed a system dynamics model to assess the effects of urban energy policy interventions on household energy consumption and gendered measures using Drakenstein Municipality as a case study. The study used secondary data from various sources for the model parameters. We tested three hypothetical policy scenarios: the business-as-usual, the energy subsidy policy and the energy efficiency policy. The results show that understanding the changes in urban household energy consumption and gendered measures due to energy transition interventions is essential for urban policy planning. The energy subsidy policy scenario was observed to increase total energy consumption but also resulted in socio-environmental impacts that might increase inequality and impair human health. Urban household energy transition interventions need to consider a systems approach to develop decision support tools that capture the cross-sector impacts and inform the development of interventions that promote gendered household energy transition.</p>",,,,,,,,,0,0,0,0.0,0,0,0,,,,1996-1073,,WOS:000718441300001,,"Towards a Systemic Assessment of Gendered Energy Transition in Urban HouseholdsAssessment of gendered energy transition at an urban scale has emerged as a challenging issue for researchers, policy makers and practitioners. With municipalities becoming players in the energy markets, their involvement raises policy issues that need to be better assessed in supporting gendered energy transition. This paper, therefore, contributes to gendered energy transition assessments at urban household level from a policy maker perspective. We developed a system dynamics model to assess the effects of urban energy policy interventions on household energy consumption and gendered measures using Drakenstein Municipality as a case study. The study used secondary data from various sources for the model parameters. We tested three hypothetical policy scenarios: the business-as-usual, the energy subsidy policy and the energy efficiency policy. The results show that understanding the changes in urban household energy consumption and gendered measures due to energy transition interventions is essential for urban policy planning. The energy subsidy policy scenario was observed to increase total energy consumption but also resulted in socio-environmental impacts that might increase inequality and impair human health. Urban household energy transition interventions need to consider a systems approach to develop decision support tools that capture the cross-sector impacts and inform the development of interventions that promote gendered household energy transition.</p>",14.0,0.0,0.0,0.0,0.0,0.0,0.0,1.0,6.0,0.0,1.0,0.0,0.0,9.0,1.0,2.0,0.0,0.0,0.0,1.0,0.0,2.0,0.0,5.0,0.0,1.0,0.0,0.0,0.0,0.0,0.0,0.0,1.0,44.0,44.0,0,216,0.2037037037037037,True,True,True,True,True,True,False,False,True,False,True,2.0,2.0,2.0,1.0,6.0,5.0,False,False,False,2.0,2.0,2.0,1.0,6.0,5.0,False,False,False,4.0,4.0,4.0,12.0,False,0
10,10,J,"Jenkins, Kirsten; Sovacool, Benjamin K.; McCauley, Darren",,,,"Sovacool, Benjamin/Y-2392-2019","Sovacool, Benjamin/0000-0002-4794-9403; Jenkins, Kirsten/0000-0002-3681-647X; McCauley, Darren/0000-0002-3951-1129",,,Humanizing sociotechnical transitions through energy justice: An ethical framework for global transformative change,,,,,,,,ENERGY POLICY,,,,117.0,,,,66,74,,10.1016/j.enpol.2018.02.036,,,,JUN 2018,2018,"Poverty, climate change and energy security demand awareness about the interlinkages between energy systems and social justice. Amidst these challenges, energy justice has emerged to conceptualize a world where all individuals, across all areas, have safe, affordable and sustainable energy that is, essentially, socially just. Simultaneously, new social and technological solutions to energy problems continually evolve, and interest in the concept of sociotechnical transitions has grown. However, an element often missing from such transitions frameworks is explicit engagement with energy justice frameworks. Despite the development of an embryonic set of literature around these themes, an obvious research gap has emerged: can energy justice and transitions frameworks be combined? This paper argues that they can. It does so through an exploration of the multi-level perspective on sociotechnical systems and an integration of energy justice at the model's niche, regime and landscape level. It presents the argument that it is within the overarching process of sociotechnical change that issues of energy justice emerge. Here, inattention to social justice issues can cause injustices, whereas attention to them can provide a means to examine and potential resolve them.",,,,,,,,,112,0,0,0.0,4,0,112,,,0301-4215,1873-6777,,WOS:000431932600007,,"Humanizing sociotechnical transitions through energy justice: An ethical framework for global transformative changePoverty, climate change and energy security demand awareness about the interlinkages between energy systems and social justice. Amidst these challenges, energy justice has emerged to conceptualize a world where all individuals, across all areas, have safe, affordable and sustainable energy that is, essentially, socially just. Simultaneously, new social and technological solutions to energy problems continually evolve, and interest in the concept of sociotechnical transitions has grown. However, an element often missing from such transitions frameworks is explicit engagement with energy justice frameworks. Despite the development of an embryonic set of literature around these themes, an obvious research gap has emerged: can energy justice and transitions frameworks be combined? This paper argues that they can. It does so through an exploration of the multi-level perspective on sociotechnical systems and an integration of energy justice at the model's niche, regime and landscape level. It presents the argument that it is within the overarching process of sociotechnical change that issues of energy justice emerge. Here, inattention to social justice issues can cause injustices, whereas attention to them can provide a means to examine and potential resolve them.",10.0,0.0,0.0,1.0,0.0,1.0,0.0,0.0,4.0,0.0,1.0,0.0,0.0,0.0,0.0,1.0,0.0,0.0,0.0,0.0,4.0,0.0,0.0,0.0,0.0,8.0,0.0,0.0,0.0,0.0,9.0,0.0,0.0,39.0,39.0,0,196,0.1989795918367347,True,True,True,True,True,False,False,True,True,False,True,3.0,2.0,2.0,2.0,6.0,5.0,True,False,False,2.0,2.0,1.0,2.0,6.0,5.0,True,True,False,5.0,4.0,3.0,12.0,False,0
11,11,J,"Chapman, Andrew; Fraser, Timothy; Dennis, Melanie",,,,"Chapman, Andrew/C-4200-2017","Chapman, Andrew/0000-0002-2519-2382; Fraser, Timothy/0000-0002-4509-0244",,,Investigating Ties between Energy Policy and Social Equity Research: A Citation Network Analysis,,,,,,,,SOCIAL SCIENCES-BASEL,,,,8.0,5,,,,,135,10.3390/socsci8050135,,,,MAY 2019,2019,"Just over twenty years ago, the Kyoto Protocol brought nations together to address the emergent issue of climate change. To support the development of energy policy, a number of academic fields were strengthened, particularly surrounding sustainable development and the economic, environmental, and social aspects of sustainability. This research focuses on the social aspects of energy policy, beginning with climate justice, through to the emergence of energy justice and the notion of a just transition. Through a bibliometric analysis of 5529 academic studies incorporating energy policy and social equity across relevant academic fields, strong ties among five distinct schools of thought were identified. Interestingly, energy transitions scholarship appears distinct from most social equity and energy justice related scholarship. There is a need to better integrate disparate schools of thought in order to achieve a just transitions framework able to address inequities in energy policy outcomes in the Paris Agreement era and beyond.",,,,,,,,,3,0,0,0.0,0,0,3,,,,2076-0760,,WOS:000683571100006,,"Investigating Ties between Energy Policy and Social Equity Research: A Citation Network AnalysisJust over twenty years ago, the Kyoto Protocol brought nations together to address the emergent issue of climate change. To support the development of energy policy, a number of academic fields were strengthened, particularly surrounding sustainable development and the economic, environmental, and social aspects of sustainability. This research focuses on the social aspects of energy policy, beginning with climate justice, through to the emergence of energy justice and the notion of a just transition. Through a bibliometric analysis of 5529 academic studies incorporating energy policy and social equity across relevant academic fields, strong ties among five distinct schools of thought were identified. Interestingly, energy transitions scholarship appears distinct from most social equity and energy justice related scholarship. There is a need to better integrate disparate schools of thought in order to achieve a just transitions framework able to address inequities in energy policy outcomes in the Paris Agreement era and beyond.",7.0,0.0,0.0,2.0,0.0,2.0,0.0,1.0,3.0,0.0,2.0,0.0,0.0,4.0,0.0,0.0,0.0,0.0,0.0,0.0,1.0,0.0,0.0,0.0,0.0,4.0,0.0,0.0,0.0,0.0,3.0,3.0,0.0,32.0,32.0,0,163,0.1963190184049079,True,True,True,False,False,False,False,True,True,True,True,3.0,0.0,1.0,2.0,7.0,5.0,True,False,False,3.0,0.0,1.0,2.0,6.0,5.0,True,True,False,6.0,0.0,2.0,8.0,False,0
