13,13,J,"Buylova, Alexandra",,,,,,,,Spotlight on energy efficiency in Oregon: Investigating dynamics between energy use and socio-demographic characteristics in spatial modeling of residential energy consumption,,,,,,,,ENERGY POLICY,,,,140.0,,,,,,111439,10.1016/j.enpol.2020.111439,,,,MAY 2020,2020,"As the state of Oregon transitions to a low-carbon economy, households currently experiencing a high energy cost burden may be vulnerable to future energy price fluctuations. To identify areas susceptible to high energy burden, this study models household energy use intensity on a census-tract level in Oregon. Findings are compared with housing, racial, and sociodemographic characteristics to explore factors associated with high energy use. Finally, energy cost index is constructed and mapped to identify census tracts vulnerable to high energy burden for targeted program and policy development. Study results reveal that census tracts with higher level of energy use intensity have higher percent of older housing, low-income households, households experiencing energy burden, and populations of racial minorities and without high school diploma. This research advances our understanding of differences in energy consumption across diverse population groups and provides detailed information on energy use and energy cost burden for state-level policymaking.",,,,,,,,,3,0,0,0.0,1,0,3,,,0301-4215,1873-6777,,WOS:000529795600054,,"Spotlight on energy efficiency in Oregon: Investigating dynamics between energy use and socio-demographic characteristics in spatial modeling of residential energy consumptionAs the state of Oregon transitions to a low-carbon economy, households currently experiencing a high energy cost burden may be vulnerable to future energy price fluctuations. To identify areas susceptible to high energy burden, this study models household energy use intensity on a census-tract level in Oregon. Findings are compared with housing, racial, and sociodemographic characteristics to explore factors associated with high energy use. Finally, energy cost index is constructed and mapped to identify census tracts vulnerable to high energy burden for targeted program and policy development. Study results reveal that census tracts with higher level of energy use intensity have higher percent of older housing, low-income households, households experiencing energy burden, and populations of racial minorities and without high school diploma. This research advances our understanding of differences in energy consumption across diverse population groups and provides detailed information on energy use and energy cost burden for state-level policymaking.",15.0,0.0,0.0,0.0,1.0,0.0,0.0,0.0,1.0,0.0,1.0,0.0,0.0,2.0,0.0,2.0,0.0,0.0,0.0,0.0,0.0,0.0,0.0,4.0,0.0,3.0,2.0,0.0,0.0,1.0,0.0,0.0,0.0,32.0,32.0,0,170,0.188235294117647,True,True,True,True,True,True,False,False,True,False,True,2.0,2.0,3.0,1.0,8.0,5.0,True,False,False,2.0,2.0,3.0,1.0,8.0,5.0,True,False,False,4.0,4.0,6.0,14.0,False,0
14,14,J,"Sovacool, Benjamin K.; Martiskainen, Mari; Hook, Andrew; Baker, Lucy",,,,"Martiskainen, Mari/ABA-7139-2021","Sovacool, Benjamin/0000-0002-4794-9403; Martiskainen, Mari/0000-0002-3503-9197",,,Decarbonization and its discontents: a critical energy justice perspective on four low-carbon transitions,,,,,,,,CLIMATIC CHANGE,,,,155.0,4,,,581,619,,10.1007/s10584-019-02521-7,,,,AUG 2019,2019,"Low-carbon transitions are often assumed as positive phenomena, because they supposedly reduce carbon emissions, yet without vigilance, there is evidence that they can in fact create new injustices and vulnerabilities, while also failing to address pre-existing structural drivers of injustice in energy markets and the wider socio-economy. With this in mind, we examine four European low-carbon transitions from an unusual normative perspective: that of energy justice. Because a multitude of studies looks at the co-benefits of renewable energy, low-carbon mobility, or climate change mitigation, we instead ask in this paper what are the types of injustices associated with low-carbon transitions? Relatedly, in what ways do low-carbon transitions worsen social risks or vulnerabilities? Lastly, what policies might be deployed to make these transitions more just? We answer these questions by first elaborating an energy justice framework consisting of four distinct dimensions-distributive justice (costs and benefits), procedural justice (due process), cosmopolitan justice (global externalities), and recognition justice (vulnerable groups). We then examine four European low-carbon transitions-nuclear power in France, smart meters in Great Britain, electric vehicles in Norway, and solar energy in Germany-through this critical justice lens. In doing so, we draw from original data collected from 64 semi-structured interviews with expert participants as well as five public focus groups and the monitoring of twelve large internet forums. We document 120 distinct energy injustices across these four transitions, including 19 commonly recurring injustices. We aim to show how when low-carbon transitions unfold, deeper injustices related to equity, distribution, and fairness invariably arise.",,,,,,,,,65,0,0,0.0,1,0,65,,,0165-0009,1573-1480,,WOS:000486260000008,,"Decarbonization and its discontents: a critical energy justice perspective on four low-carbon transitionsLow-carbon transitions are often assumed as positive phenomena, because they supposedly reduce carbon emissions, yet without vigilance, there is evidence that they can in fact create new injustices and vulnerabilities, while also failing to address pre-existing structural drivers of injustice in energy markets and the wider socio-economy. With this in mind, we examine four European low-carbon transitions from an unusual normative perspective: that of energy justice. Because a multitude of studies looks at the co-benefits of renewable energy, low-carbon mobility, or climate change mitigation, we instead ask in this paper what are the types of injustices associated with low-carbon transitions? Relatedly, in what ways do low-carbon transitions worsen social risks or vulnerabilities? Lastly, what policies might be deployed to make these transitions more just? We answer these questions by first elaborating an energy justice framework consisting of four distinct dimensions-distributive justice (costs and benefits), procedural justice (due process), cosmopolitan justice (global externalities), and recognition justice (vulnerable groups). We then examine four European low-carbon transitions-nuclear power in France, smart meters in Great Britain, electric vehicles in Norway, and solar energy in Germany-through this critical justice lens. In doing so, we draw from original data collected from 64 semi-structured interviews with expert participants as well as five public focus groups and the monitoring of twelve large internet forums. We document 120 distinct energy injustices across these four transitions, including 19 commonly recurring injustices. We aim to show how when low-carbon transitions unfold, deeper injustices related to equity, distribution, and fairness invariably arise.",7.0,0.0,0.0,1.0,10.0,0.0,1.0,0.0,9.0,0.0,0.0,0.0,0.0,1.0,0.0,0.0,0.0,0.0,0.0,0.0,1.0,0.0,0.0,0.0,0.0,3.0,0.0,0.0,0.0,0.0,14.0,1.0,0.0,48.0,48.0,0,262,0.183206106870229,True,True,True,True,True,True,False,False,True,True,True,3.0,0.0,1.0,2.0,6.0,5.0,True,False,False,3.0,0.0,2.0,2.0,6.0,5.0,True,True,True,6.0,0.0,3.0,9.0,False,1
15,15,J,"Fan, Shengyue; Zha, Shuai; Zhao, Chenxi; Sizheng, Fangyuan; Li, Meihui",,,,,,,,"Using energy vulnerability to measure distributive injustice in rural heating energy reform: A case study of natural gas replacing bulk coal for heating in Gaocheng District, Hebei Province, China",,,,,,,,ECOLOGICAL ECONOMICS,,,,197.0,,,,,,107456,10.1016/j.ecolecon.2022.107456,,,,JUL 2022,2022,"Proponents of distributive justice with regard to energy hold that every household has the right to affordable access to energy. However, when passively participating in clean energy reform policies, households, and especially low-income households, are often forced to use energy beyond the scope of affordability, resulting in distributive injustice. However, research on the quantitative estimation of injustice in energy distribution is still rare. In this paper, an evaluation model of energy vulnerability and distributive justice is established through the reverse deduction method,  and the change value of energy vulnerability before and after energy reform is used to calculate the loss value of distributive justice, which is used as the basis for energy policy evaluation. Taking the policy of replacing coal with natural gas for rural heating in Gaocheng District, Hebei Province, China as a case study, the value of lost distributive justice is calculated. The results show that 34.51% of households experienced distributive injustice after the energy reform, while 19.34% of households improved their energy vulnerability and achieved energy justice through energy subsidy policies. However, 46.15% of households were able to adapt to the energy reform independently without subsidies, which indicates a waste of resources in the energy subsidy policy. The policy implication of these results is that differentiated energy subsidy policies should be implemented according to household energy vulnerability, so as to maximize the policy benefits on the premise of ensuring justice in household energy distribution and minimizing injustice. The empirical study proves that the method of assessing injustice in energy distribution based on the reverse deduction method  of energy vulnerability is feasible and a new attempt.",,,,,,,,,0,0,0,0.0,0,0,0,,,0921-8009,1873-6106,,WOS:000804559200006,,"Using energy vulnerability to measure distributive injustice in rural heating energy reform: A case study of natural gas replacing bulk coal for heating in Gaocheng District, Hebei Province, ChinaProponents of distributive justice with regard to energy hold that every household has the right to affordable access to energy. However, when passively participating in clean energy reform policies, households, and especially low-income households, are often forced to use energy beyond the scope of affordability, resulting in distributive injustice. However, research on the quantitative estimation of injustice in energy distribution is still rare. In this paper, an evaluation model of energy vulnerability and distributive justice is established through the reverse deduction method,  and the change value of energy vulnerability before and after energy reform is used to calculate the loss value of distributive justice, which is used as the basis for energy policy evaluation. Taking the policy of replacing coal with natural gas for rural heating in Gaocheng District, Hebei Province, China as a case study, the value of lost distributive justice is calculated. The results show that 34.51% of households experienced distributive injustice after the energy reform, while 19.34% of households improved their energy vulnerability and achieved energy justice through energy subsidy policies. However, 46.15% of households were able to adapt to the energy reform independently without subsidies, which indicates a waste of resources in the energy subsidy policy. The policy implication of these results is that differentiated energy subsidy policies should be implemented according to household energy vulnerability, so as to maximize the policy benefits on the premise of ensuring justice in household energy distribution and minimizing injustice. The empirical study proves that the method of assessing injustice in energy distribution based on the reverse deduction method  of energy vulnerability is feasible and a new attempt.",22.0,0.0,3.0,0.0,0.0,0.0,0.0,0.0,0.0,0.0,0.0,0.0,0.0,8.0,0.0,1.0,0.0,0.0,0.0,0.0,0.0,0.0,0.0,8.0,0.0,0.0,0.0,0.0,0.0,0.0,12.0,0.0,0.0,54.0,54.0,0,296,0.1824324324324324,True,True,True,True,True,True,False,False,False,False,True,3.0,3.0,3.0,1.0,9.0,3.0,True,False,False,2.0,3.0,3.0,1.0,8.0,3.0,True,False,False,5.0,6.0,6.0,17.0,False,0
16,16,J,"Meng, Qingmin",,,,,"Meng, Qingmin/0000-0002-6287-5553",,,Fracking equity: A spatial justice analysis prototype,,,,,,,,LAND USE POLICY,,,,70.0,,,,10,15,,10.1016/j.landusepol.2017.10.021,,,,JAN 2018,2018,"Although current environmental justice analyses shed light on fracking and fracking's environmental and public health policy, a comprehensive justice analysis framework is needed in order to cover the policy gap of fracking impacts on the total environment, communities, and sustainability. Based on a concise summary of the effects of fracking on the total environment, the society and economy, and land use, this brief communication designs a conception of fracking equity and its spatial justice analysis prototype. Fracking equity is much beyond the scope of current environmental justice or social justice that is spatially limited within certain distance to fracking wells. Fracking equity based on the benefit and harm associated with fracking, not only encompasses environmental justice, social justice, but also emphasizes all stakeholder groups, the spatiotemporal characteristics of the justice of fracking, sustainable development, and the integrated analyzing methods including GIS, decision making, demographic analysis, spatiotemporal modeling at different scales, and long term analysis of fracking equity. Spatial justice of fracking unites the environmental, social, economic, ecological factors and their processes that are temporally changing and reshaping the space people live in and depend on, and these complicated factors and their dynamic interactions are the core of spatial justice.",,,,,,,,,12,0,0,0.0,2,0,13,,,0264-8377,1873-5754,,WOS:000419416600002,,"Fracking equity: A spatial justice analysis prototypeAlthough current environmental justice analyses shed light on fracking and fracking's environmental and public health policy, a comprehensive justice analysis framework is needed in order to cover the policy gap of fracking impacts on the total environment, communities, and sustainability. Based on a concise summary of the effects of fracking on the total environment, the society and economy, and land use, this brief communication designs a conception of fracking equity and its spatial justice analysis prototype. Fracking equity is much beyond the scope of current environmental justice or social justice that is spatially limited within certain distance to fracking wells. Fracking equity based on the benefit and harm associated with fracking, not only encompasses environmental justice, social justice, but also emphasizes all stakeholder groups, the spatiotemporal characteristics of the justice of fracking, sustainable development, and the integrated analyzing methods including GIS, decision making, demographic analysis, spatiotemporal modeling at different scales, and long term analysis of fracking equity. Spatial justice of fracking unites the environmental, social, economic, ecological factors and their processes that are temporally changing and reshaping the space people live in and depend on, and these complicated factors and their dynamic interactions are the core of spatial justice.",0.0,0.0,0.0,0.0,0.0,2.0,0.0,7.0,0.0,0.0,1.0,0.0,0.0,2.0,0.0,1.0,0.0,0.0,0.0,0.0,1.0,0.0,0.0,0.0,0.0,5.0,0.0,1.0,1.0,0.0,11.0,5.0,0.0,37.0,37.0,0,205,0.1804878048780487,True,True,True,True,True,True,False,False,False,False,True,3.0,2.0,1.0,1.0,9.0,5.0,True,False,False,3.0,2.0,2.0,2.0,9.0,5.0,False,False,False,6.0,4.0,3.0,13.0,False,0
17,17,J,"Stephens, Jennie C.",,,,,"Stephens, Jennie/0000-0003-0386-8115",,,Electrification: Opportunities for social justice and social innovation,,,,,,,,MRS BULLETIN,,,,46.0,12,SI,,1205,1209,,10.1557/s43577-021-00245-7,,JAN 2022,,DEC 2021,2021,"While much of the research and investment on electrification focuses on technology and materials, the transformation away from fossil fuels to a more regenerative, sustainable future that relies on renewable energy also provides huge opportunities for advancing social justice. Unfortunately, society has so far underinvested in the research and development, demonstration, and deployment of social innovations in this energy transformation, so many electrification initiatives have disproportionately benefited wealthy communities and countries and exacerbated social injustices, economic inequities, health disparities, and further concentrated wealth and power. Energy democracy provides a valuable framework to identify and disrupt these trends and leverage the transformative opportunities for social innovation and social justice with electrification. As the sourcing and recycling of new and different materials required for renewable energy generation expands, social justice must be prioritized. To enable a just transition, investing in social innovation in how and where materials are sourced and recycled is essential.",,,,,,,,,1,0,0,0.0,0,0,1,,,0883-7694,1938-1425,,WOS:000746798400002,,"Electrification: Opportunities for social justice and social innovationWhile much of the research and investment on electrification focuses on technology and materials, the transformation away from fossil fuels to a more regenerative, sustainable future that relies on renewable energy also provides huge opportunities for advancing social justice. Unfortunately, society has so far underinvested in the research and development, demonstration, and deployment of social innovations in this energy transformation, so many electrification initiatives have disproportionately benefited wealthy communities and countries and exacerbated social injustices, economic inequities, health disparities, and further concentrated wealth and power. Energy democracy provides a valuable framework to identify and disrupt these trends and leverage the transformative opportunities for social innovation and social justice with electrification. As the sourcing and recycling of new and different materials required for renewable energy generation expands, social justice must be prioritized. To enable a just transition, investing in social innovation in how and where materials are sourced and recycled is essential.",3.0,0.0,0.0,0.0,0.0,1.0,2.0,0.0,1.0,2.0,1.0,0.0,0.0,0.0,0.0,0.0,0.0,0.0,0.0,0.0,1.0,0.0,0.0,0.0,0.0,10.0,0.0,1.0,0.0,0.0,5.0,1.0,0.0,28.0,28.0,0,158,0.1772151898734177,True,True,True,True,True,True,False,False,False,False,True,1.0,1.0,2.0,2.0,6.0,4.0,True,False,False,1.0,1.0,2.0,2.0,6.0,5.0,True,True,False,2.0,2.0,4.0,8.0,False,0
19,19,J,"Cieplinski, A.; D'Alessandro, S.; Distefano, T.; Guarnieri, P.",,,,"Distefano, Tiziano/AAR-2458-2021","Distefano, Tiziano/0000-0002-1593-6480; Guarnieri, Pietro/0000-0001-5107-7305; D'Alessandro, Simone/0000-0002-5550-3313",,,Coupling environmental transition and social prosperity: a scenario-analysis of the Italian case,,,,,,,,STRUCTURAL CHANGE AND ECONOMIC DYNAMICS,,,,57.0,,,,265,278,,10.1016/j.strueco.2021.03.007,,APR 2021,,JUN 2021,2021,"This paper investigates to what extent green growth is able to promote social equity and which social policies can complement environmental policies to achieve social prosperity and sustainability. We develop a dynamic macrosimulation model to explore the social and structural effects of the Italian national energy and climate plan. We show that green growth alone will not result in better societal conditions and needs to be compensated with social policies that directly tackle inequality. Consequently, we select two social policies that are expected to improve income distribution, namely a basic income programme and working time reduction. Our scenario analysis shows that working time reduction leads to an increase in employment and a parallel decrease in aggregate demand that causes a reduction in emissions and inequality. The basic income programme reduces inequality by sustaining aggregate demand which, in turn, partially offsets the positive environmental effects of the energy plan. (C) 2021 Elsevier B.V. All rights reserved.",,,,,,,,,0,0,0,0.0,0,0,0,,,0954-349X,1873-6017,,WOS:000652842000021,,"Coupling environmental transition and social prosperity: a scenario-analysis of the Italian caseThis paper investigates to what extent green growth is able to promote social equity and which social policies can complement environmental policies to achieve social prosperity and sustainability. We develop a dynamic macrosimulation model to explore the social and structural effects of the Italian national energy and climate plan. We show that green growth alone will not result in better societal conditions and needs to be compensated with social policies that directly tackle inequality. Consequently, we select two social policies that are expected to improve income distribution, namely a basic income programme and working time reduction. Our scenario analysis shows that working time reduction leads to an increase in employment and a parallel decrease in aggregate demand that causes a reduction in emissions and inequality. The basic income programme reduces inequality by sustaining aggregate demand which, in turn, partially offsets the positive environmental effects of the energy plan. (C) 2021 Elsevier B.V. All rights reserved.",2.0,0.0,0.0,1.0,0.0,1.0,0.0,3.0,1.0,0.0,0.0,0.0,0.0,4.0,0.0,1.0,0.0,1.0,0.0,0.0,0.0,2.0,0.0,0.0,0.0,8.0,0.0,0.0,0.0,0.0,0.0,1.0,3.0,28.0,28.0,0,166,0.1686746987951807,True,True,True,True,True,True,False,False,False,False,True,2.0,3.0,2.0,2.0,9.0,5.0,True,False,False,2.0,3.0,2.0,1.0,6.0,5.0,False,False,False,4.0,6.0,4.0,14.0,False,0
20,20,J,"Rosen, Marc A.",,,,,,,,Energy Sustainability with a Focus on Environmental Perspectives,,,,,,,,EARTH SYSTEMS AND ENVIRONMENT,,,,5.0,2,,,217,230,,10.1007/s41748-021-00217-6,,APR 2021,,JUN 2021,2021,"Energy sustainability is a key consideration for anthropogenic activity and the development of societies, and more broadly, civilization. In this article, energy sustainability is described and examined, as are methods and technologies that can help enhance it. As a key component of sustainability, the significance and importance of energy sustainability becomes clear. Requirements to enhance energy sustainability are described, including low environmental and ecological impacts, sustainable energy resources and complementary energy carriers, high efficiencies, and various other factors. The latter are predominantly non-technical, and include living standards, societal acceptability and equity. The outcomes and results are anticipated to inform and educate about energy sustainability, to provide an impetus to greater energy sustainability.",,,,,,,,,8,0,0,0.0,1,0,8,,,2509-9426,2509-9434,,WOS:000642379700001,34723079.0,"Energy Sustainability with a Focus on Environmental PerspectivesEnergy sustainability is a key consideration for anthropogenic activity and the development of societies, and more broadly, civilization. In this article, energy sustainability is described and examined, as are methods and technologies that can help enhance it. As a key component of sustainability, the significance and importance of energy sustainability becomes clear. Requirements to enhance energy sustainability are described, including low environmental and ecological impacts, sustainable energy resources and complementary energy carriers, high efficiencies, and various other factors. The latter are predominantly non-technical, and include living standards, societal acceptability and equity. The outcomes and results are anticipated to inform and educate about energy sustainability, to provide an impetus to greater energy sustainability.",7.0,0.0,0.0,0.0,0.0,8.0,0.0,1.0,0.0,0.0,1.0,0.0,0.0,0.0,0.0,0.0,0.0,0.0,0.0,0.0,0.0,0.0,0.0,0.0,0.0,2.0,0.0,0.0,0.0,0.0,0.0,1.0,0.0,20.0,20.0,0,119,0.1680672268907563,True,True,True,True,True,True,False,False,False,False,True,3.0,1.0,1.0,2.0,9.0,5.0,False,False,False,3.0,1.0,1.0,2.0,9.0,5.0,False,False,False,6.0,2.0,2.0,10.0,False,0
